{
  "schema_version": 1,
  "message_id": "0192f4d0-5e6f-7a80-9c93-9d0e1f2a3b4c",
  "message_type": "account.user_status_changed.v1",
  "occurred_at": "2026-10-24T09:30:00Z",
  "correlation_id": "0192f4cf-6f70-7b81-8da4-0e1f2a3b4c5d",
  "event_key": "0192f4cf-6f70-7b81-8da4-0e1f2a3b4c5d",
  "user_id": "4f6c1e9a-2b7d-4c8e-9f0a-1b2c3d4e5f60",
  "status_version": 3,
  "from_status": "active",
  "to_status": "suspended",
  "reason_code": "abuse",
  "changed_by": "8d2f6a1c-3b4e-4f5a-9c6d-7e8f9a0b1c2d",
  "changed_at": "2026-10-24T09:30:00Z"
}
