{
  "schema_version": 1,
  "message_id": "0192f4e0-7a81-7c92-8eb5-1f2a3b4c5d6e",
  "message_type": "account.user_status_changed.v1",
  "occurred_at": "2026-10-25T09:30:00Z",
  "correlation_id": "0192f4df-8b92-7da3-9fc6-2a3b4c5d6e7f",
  "event_key": "0192f4df-8b92-7da3-9fc6-2a3b4c5d6e7f",
  "user_id": "4f6c1e9a-2b7d-4c8e-9f0a-1b2c3d4e5f60",
  "status_version": 4,
  "from_status": "suspended",
  "to_status": "active",
  "reason_code": null,
  "changed_by": null,
  "changed_at": "2026-10-25T09:30:00Z"
}
